title,url,date,author,category,excerpt,content_length,tags,notes
Ancient History Encyclopedia in Armenia,https://www.worldhistory.org/article/1150/ancient-history-encyclopedia-in-armenia,08-Nov-17,,History,"Last fall, Ancient History Encyclopedia (AHE) received a grant from the National Association for Armenian Studies and Research (NAASR) and the Knights of Vartan...",13828,,
Ancient History Encyclopedia in Japan,https://www.worldhistory.org/article/1172/ancient-history-encyclopedia-in-japan,12-Jan-18,,History,The “Ancient Japan” initiative at Ancient History Encyclopedia arose as there is a dearth of open access and digitally curated information concerning early Japanese...,16302,,
Ancient Iranian Salt Mine Mummies,https://www.worldhistory.org/article/747/ancient-iranian-salt-mine-mummies,06-Aug-14,,History,"As a young girl interested in archaeology and history, mummies always intrigued me. From the intricate Egyptian mummies to the naturally and beautifully preserved...",17027,,
Ancient Israelite & Judean Religion,https://www.worldhistory.org/article/1097/ancient-israelite--judean-religion,13-Jul-17,,History,"As early as the 10th century BCE, Israelite and Judean religion began to emerge within the broader West Semitic culture, otherwise known as Canaanite culture...",25881,,
Ancient Japanese & Chinese Relations,https://www.worldhistory.org/article/1085/ancient-japanese--chinese-relations,27-Jun-17,,History,"Relations between ancient Japan and China have a long history, and in certain periods the exchange of political, religious and cultural practices between the...",17947,,
Ancient Korean & Chinese Relations,https://www.worldhistory.org/article/984/ancient-korean--chinese-relations,30-Nov-16,,History,Contact between Korea and China goes back to mythology and prehistory. Trade developed from the Bronze and Iron Ages with raw materials and manufactured goods...,22513,,
Ancient Korean & Japanese Relations,https://www.worldhistory.org/article/982/ancient-korean--japanese-relations,25-Nov-16,,History,"Ancient East Asia was dominated by the three states known today as China, Japan, and Korea. These kingdoms traded raw materials and high-quality manufactured...",16807,,
Ancient Mesopotamian Beliefs in the Afterlife,https://www.worldhistory.org/article/701/ancient-mesopotamian-beliefs-in-the-afterlife,20-Jun-14,,History,"Unlike the rich corpus of ancient Egyptian funerary texts, no such “guidebooks” from Mesopotamia detail the afterlife and the soul's fate after death. Instead...",24871,,
Ancient Mesopotamian Ghost Spell,https://www.worldhistory.org/article/2180/ancient-mesopotamian-ghost-spell,02-Mar-23,,History,"Medicine in ancient Mesopotamia was based on the belief that illness was caused by supernatural agencies and, although medicines were given and injuries treated...",23845,,
"Ancient Persian Gods, Heroes, and Creatures - The Complete List",https://www.worldhistory.org/article/1488/ancient-persian-gods-heroes-and-creatures---the-co,16-Jan-20,,History,"The term 'mythology' comes from the Greek mythos (story-of-the-people) and logos (word or speech), meaning the spoken story of a people. Every civilization of...",53812,,
Ancient Roman Family Life,https://www.worldhistory.org/article/870/ancient-roman-family-life,26-Feb-16,,History,"Whether there was a king, a consul, or an emperor that stood supreme over Rome and its territories, the one constant throughout Roman history was the family...",17455,,
Ancient Roman Society,https://www.worldhistory.org/article/1463/ancient-roman-society,23-Oct-19,,History,Rome began as a small city on the banks of the Tiber River in Italy. The Latin tribes (also known as the Latini or Latians) inhabited the region c. 1000 BCE but...,26553,,
Angels in Ancient Judaism,https://www.worldhistory.org/article/2538/angels-in-ancient-judaism,18-Sep-24,,History,The concept and function of angels in ancient Judaism were some of the many elements incorporated from contemporary cultures and religious views. The Hebrew malakh...,24119,,
Angels in Christianity,https://www.worldhistory.org/article/2541/angels-in-christianity,30-Sep-24,,History,"Angels in Christianity act as messengers of God, bring good news, and help believers. Their role developed from the function of angels in ancient Judaism but...",24015,,
Another Ariamanus Statue Found: The Evil Spirit of Mithraic Religion,https://www.worldhistory.org/article/685/another-ariamanus-statue-found-the-evil-spirit-of,14-May-14,,History,"It is rare when a new find creates renewed interest in an old subject. Here, the new find is a leontocephaline (lion-headed) figure of unknown provenance, weighing...",18828,,
